{
  "meta": {
    "country": "DE",
    "unit": "mm",
    "schema_version": "1.2",
    "photos": [],
    "notes": [
      "Hand-written test house for stage 2 - no real measurement data.",
      "Detached gable roof, 2 stories: footprint 10000 x 8000 mm, eave 5500 mm, ridge 8000 mm exact; pitch is geometrically atan(2500/4000) = 32.005383208083494 degrees = exactly 7.5/12 rise over run.",
      "Convention: RF-1 = front roof face, RF-2 = back roof face. The ridge runs along the 10 m axis.",
      "Convention rakes: E-4 = left/front, E-5 = left/back, E-6 = right/front, E-7 = right/back.",
      "Convention outside corners: E-8 front-left, E-9 front-right, E-10 back-right, E-11 back-left (clockwise from the front-left corner, like footprint.points).",
      "E-12 (flashing) and E-13 (step_flashing) are roof-metal edges without massing geometry - they appear in lists only, not in the 3D model."
    ]
  },
  "references": [],
  "building": {
    "building_type": "detached",
    "stories": 2,
    "roof_type": "gable",
    "footprint": {
      "points": [
        [0, 0],
        [10000, 0],
        [10000, 8000],
        [0, 8000]
      ],
      "width_mm": {
        "value": 10000,
        "confidence": "high",
        "source": "measured",
        "reference_used": null
      },
      "depth_mm": {
        "value": 8000,
        "confidence": "high",
        "source": "measured",
        "reference_used": null
      },
      "perimeter_mm": null,
      "area_mm2": null
    },
    "heights": {
      "eave_height_mm": {
        "value": 5500,
        "confidence": "high",
        "source": "measured",
        "reference_used": null
      },
      "ridge_height_mm": {
        "value": 8000,
        "confidence": "high",
        "source": "measured",
        "reference_used": null
      },
      "parapet_height_mm": null
    },
    "shared_walls": []
  },
  "faces": [
    {
      "id": "WL-1",
      "face_class": "wall",
      "elevation": "front",
      "material": "stucco",
      "area_mm2": {
        "value": 55000000,
        "confidence": "high",
        "source": "measured",
        "reference_used": null
      },
      "net_area_mm2": null,
      "pitch": null,
      "orientation_deg": null
    },
    {
      "id": "WL-2",
      "face_class": "wall",
      "elevation": "back",
      "material": "stucco",
      "area_mm2": {
        "value": 55000000,
        "confidence": "high",
        "source": "measured",
        "reference_used": null
      },
      "net_area_mm2": null,
      "pitch": null,
      "orientation_deg": null
    },
    {
      "id": "WL-3",
      "face_class": "wall",
      "elevation": "left",
      "material": "stucco",
      "area_mm2": {
        "value": 54000000,
        "confidence": "high",
        "source": "measured",
        "reference_used": null
      },
      "net_area_mm2": null,
      "pitch": null,
      "orientation_deg": null
    },
    {
      "id": "WL-4",
      "face_class": "wall",
      "elevation": "right",
      "material": "stucco",
      "area_mm2": {
        "value": 54000000,
        "confidence": "high",
        "source": "measured",
        "reference_used": null
      },
      "net_area_mm2": null,
      "pitch": null,
      "orientation_deg": null
    },
    {
      "id": "RF-1",
      "face_class": "roof_face",
      "elevation": "roof",
      "material": null,
      "area_mm2": {
        "value": 47169905.66028302,
        "confidence": "high",
        "source": "measured",
        "reference_used": null
      },
      "net_area_mm2": null,
      "pitch": {
        "degrees_original": 32.005383208083494,
        "degrees_rounded": 32,
        "rise_over_12_snapped": 7.5
      },
      "orientation_deg": null
    },
    {
      "id": "RF-2",
      "face_class": "roof_face",
      "elevation": "roof",
      "material": null,
      "area_mm2": {
        "value": 47169905.66028302,
        "confidence": "high",
        "source": "measured",
        "reference_used": null
      },
      "net_area_mm2": null,
      "pitch": {
        "degrees_original": 32.005383208083494,
        "degrees_rounded": 32,
        "rise_over_12_snapped": 7.5
      },
      "orientation_deg": null
    }
  ],
  "edges": [
    {
      "id": "E-1",
      "edge_class": "ridge",
      "length_mm": {
        "value": 10000,
        "confidence": "high",
        "source": "measured",
        "reference_used": null
      },
      "belongs_to_elevation": "roof"
    },
    {
      "id": "E-2",
      "edge_class": "eave",
      "length_mm": {
        "value": 10000,
        "confidence": "high",
        "source": "measured",
        "reference_used": null
      },
      "belongs_to_elevation": "front"
    },
    {
      "id": "E-3",
      "edge_class": "eave",
      "length_mm": {
        "value": 10000,
        "confidence": "high",
        "source": "measured",
        "reference_used": null
      },
      "belongs_to_elevation": "back"
    },
    {
      "id": "E-4",
      "edge_class": "rake",
      "length_mm": {
        "value": 4716.990566028302,
        "confidence": "high",
        "source": "measured",
        "reference_used": null
      },
      "belongs_to_elevation": "left"
    },
    {
      "id": "E-5",
      "edge_class": "rake",
      "length_mm": {
        "value": 4716.990566028302,
        "confidence": "high",
        "source": "measured",
        "reference_used": null
      },
      "belongs_to_elevation": "left"
    },
    {
      "id": "E-6",
      "edge_class": "rake",
      "length_mm": {
        "value": 4716.990566028302,
        "confidence": "high",
        "source": "measured",
        "reference_used": null
      },
      "belongs_to_elevation": "right"
    },
    {
      "id": "E-7",
      "edge_class": "rake",
      "length_mm": {
        "value": 4716.990566028302,
        "confidence": "high",
        "source": "measured",
        "reference_used": null
      },
      "belongs_to_elevation": "right"
    },
    {
      "id": "E-8",
      "edge_class": "outside_corner",
      "length_mm": {
        "value": 5500,
        "confidence": "high",
        "source": "measured",
        "reference_used": null
      },
      "belongs_to_elevation": null
    },
    {
      "id": "E-9",
      "edge_class": "outside_corner",
      "length_mm": {
        "value": 5500,
        "confidence": "high",
        "source": "measured",
        "reference_used": null
      },
      "belongs_to_elevation": null
    },
    {
      "id": "E-10",
      "edge_class": "outside_corner",
      "length_mm": {
        "value": 5500,
        "confidence": "high",
        "source": "measured",
        "reference_used": null
      },
      "belongs_to_elevation": null
    },
    {
      "id": "E-11",
      "edge_class": "outside_corner",
      "length_mm": {
        "value": 5500,
        "confidence": "high",
        "source": "measured",
        "reference_used": null
      },
      "belongs_to_elevation": null
    },
    {
      "id": "E-12",
      "edge_class": "flashing",
      "length_mm": {
        "value": 1200,
        "confidence": "medium",
        "source": "estimated",
        "reference_used": null
      },
      "belongs_to_elevation": "roof"
    },
    {
      "id": "E-13",
      "edge_class": "step_flashing",
      "length_mm": {
        "value": 2500,
        "confidence": "medium",
        "source": "estimated",
        "reference_used": null
      },
      "belongs_to_elevation": "roof"
    }
  ],
  "openings": [
    {
      "id": "W-1",
      "type": "window",
      "elevation": "front",
      "width_mm": {
        "value": 1200,
        "confidence": "high",
        "source": "measured",
        "reference_used": null
      },
      "height_mm": {
        "value": 1400,
        "confidence": "high",
        "source": "measured",
        "reference_used": null
      },
      "sill_height_mm": {
        "value": 900,
        "confidence": "high",
        "source": "measured",
        "reference_used": null
      },
      "group_id": null,
      "position_mm": { "x": 5400, "y": 900 },
      "area_mm2": null,
      "perimeter_mm": null,
      "note": "Reference only, not for ordering"
    },
    {
      "id": "W-2",
      "type": "window",
      "elevation": "front",
      "width_mm": {
        "value": 1000,
        "confidence": "high",
        "source": "measured",
        "reference_used": null
      },
      "height_mm": {
        "value": 1200,
        "confidence": "high",
        "source": "measured",
        "reference_used": null
      },
      "sill_height_mm": {
        "value": 3300,
        "confidence": "high",
        "source": "measured",
        "reference_used": null
      },
      "group_id": null,
      "position_mm": { "x": 7400, "y": 3300 },
      "area_mm2": null,
      "perimeter_mm": null,
      "note": "Reference only, not for ordering"
    },
    {
      "id": "W-3",
      "type": "window",
      "elevation": "back",
      "width_mm": {
        "value": 1200,
        "confidence": "high",
        "source": "measured",
        "reference_used": null
      },
      "height_mm": {
        "value": 1400,
        "confidence": "high",
        "source": "measured",
        "reference_used": null
      },
      "sill_height_mm": {
        "value": 900,
        "confidence": "high",
        "source": "measured",
        "reference_used": null
      },
      "group_id": null,
      "position_mm": { "x": 2000, "y": 900 },
      "area_mm2": null,
      "perimeter_mm": null,
      "note": "Reference only, not for ordering"
    },
    {
      "id": "W-4",
      "type": "window",
      "elevation": "back",
      "width_mm": {
        "value": 1000,
        "confidence": "high",
        "source": "measured",
        "reference_used": null
      },
      "height_mm": {
        "value": 1200,
        "confidence": "high",
        "source": "measured",
        "reference_used": null
      },
      "sill_height_mm": {
        "value": 3300,